{
  "version": 1,
  "runtime_family": "feature-implement-v2",
  "defaults": {
    "timeout_ms": 300000,
    "permission_mode": "default",
    "cwd_policy": "project-root"
  },
  "workers": {
    "preprocessor": {
      "file": "workers/preprocessor.md",
      "model": "haiku",
      "max_turns": 10,
      "permission_mode": "acceptEdits",
      "tools": ["Read", "Glob", "Write"],
      "task_schema": "schemas/task/preprocessor-task.schema.json",
      "result_schema": "schemas/result/preprocessor-result.schema.json",
      "enabled": true,
      "category": "preprocess",
      "supports_parallelism": false,
      "execution_mode": "workspace_write"
    },
    "planner": {
      "file": "workers/planner.md",
      "model": "opus",
      "max_turns": 20,
      "permission_mode": "acceptEdits",
      "tools": ["Read", "Glob", "Grep", "Write"],
      "task_schema": "schemas/task/planner-task.schema.json",
      "result_schema": "schemas/result/planner-result.schema.json",
      "enabled": true,
      "category": "planning",
      "supports_parallelism": false,
      "execution_mode": "workspace_write"
    },
    "plan-validator": {
      "file": "workers/plan-validator.md",
      "model": "sonnet",
      "max_turns": 15,
      "permission_mode": "acceptEdits",
      "tools": ["Read", "Glob", "Grep", "Edit", "Write"],
      "task_schema": "schemas/task/plan-validator-task.schema.json",
      "result_schema": "schemas/result/plan-validator-result.schema.json",
      "enabled": true,
      "category": "planning",
      "supports_parallelism": false,
      "execution_mode": "workspace_write"
    },
    "test-writer": {
      "file": "workers/test-writer.md",
      "model": "sonnet",
      "max_turns": 40,
      "permission_mode": "acceptEdits",
      "tools": ["Read", "Glob", "Grep", "Write"],
      "task_schema": "schemas/task/test-writer-task.schema.json",
      "result_schema": "schemas/result/test-writer-result.schema.json",
      "enabled": true,
      "category": "planning",
      "supports_parallelism": false,
      "execution_mode": "workspace_write"
    },
    "coder-implement": {
      "file": "workers/coder-implement.md",
      "model": "opus",
      "max_turns": 50,
      "permission_mode": "bypassPermissions",
      "tools": ["Read", "Glob", "Grep", "Write", "Edit", "Bash"],
      "task_schema": "schemas/task/coder-implement-task.schema.json",
      "result_schema": "schemas/result/coder-implement-result.schema.json",
      "enabled": true,
      "category": "execution",
      "supports_parallelism": false,
      "execution_mode": "workspace_write"
    },
    "self-checker": {
      "file": "workers/self-checker.md",
      "model": "sonnet",
      "max_turns": 20,
      "permission_mode": "bypassPermissions",
      "tools": ["Read", "Glob", "Grep", "Edit", "Bash"],
      "task_schema": "schemas/task/self-checker-task.schema.json",
      "result_schema": "schemas/result/self-checker-result.schema.json",
      "enabled": true,
      "category": "execution",
      "supports_parallelism": false,
      "execution_mode": "workspace_write"
    },
    "cli-checker": {
      "file": "workers/cli-checker.md",
      "model": "haiku",
      "max_turns": 10,
      "permission_mode": "bypassPermissions",
      "tools": ["Bash", "Read", "Write"],
      "task_schema": "schemas/task/cli-checker-task.schema.json",
      "result_schema": "schemas/result/cli-checker-result.schema.json",
      "enabled": true,
      "category": "execution",
      "supports_parallelism": false,
      "execution_mode": "workspace_write"
    },
    "coder-fix-cli": {
      "file": "workers/coder-fix-cli.md",
      "model": "opus",
      "max_turns": 50,
      "permission_mode": "bypassPermissions",
      "tools": ["Read", "Glob", "Grep", "Write", "Edit", "Bash"],
      "task_schema": "schemas/task/coder-fix-cli-task.schema.json",
      "result_schema": "schemas/result/coder-fix-cli-result.schema.json",
      "enabled": true,
      "category": "execution",
      "supports_parallelism": false,
      "execution_mode": "workspace_write"
    },
    "validator-structural": {
      "file": "workers/validator-structural.md",
      "model": "sonnet",
      "max_turns": 30,
      "permission_mode": "plan",
      "tools": ["Read", "Glob", "Grep"],
      "task_schema": "schemas/task/validator-task.schema.json",
      "result_schema": "schemas/result/validator-result.schema.json",
      "enabled": true,
      "category": "validation",
      "supports_parallelism": true,
      "execution_mode": "read_only"
    },
    "validator-file": {
      "file": "workers/validator-file.md",
      "model": "sonnet",
      "max_turns": 30,
      "permission_mode": "plan",
      "tools": ["Read", "Glob", "Grep"],
      "task_schema": "schemas/task/validator-task.schema.json",
      "result_schema": "schemas/result/validator-result.schema.json",
      "enabled": true,
      "category": "validation",
      "supports_parallelism": true,
      "execution_mode": "read_only"
    },
    "validator-security": {
      "file": "workers/validator-security.md",
      "model": "sonnet",
      "max_turns": 30,
      "permission_mode": "plan",
      "tools": ["Read", "Glob", "Grep"],
      "task_schema": "schemas/task/validator-task.schema.json",
      "result_schema": "schemas/result/validator-result.schema.json",
      "enabled": true,
      "category": "validation",
      "supports_parallelism": true,
      "execution_mode": "read_only"
    },
    "validator-spec": {
      "file": "workers/validator-spec.md",
      "model": "sonnet",
      "max_turns": 30,
      "permission_mode": "plan",
      "tools": ["Read", "Glob", "Grep"],
      "task_schema": "schemas/task/validator-task.schema.json",
      "result_schema": "schemas/result/validator-result.schema.json",
      "enabled": true,
      "category": "validation",
      "supports_parallelism": true,
      "execution_mode": "read_only"
    },
    "aggregator": {
      "file": "workers/aggregator.md",
      "model": "sonnet",
      "max_turns": 60,
      "permission_mode": "acceptEdits",
      "tools": ["Read", "Glob", "Grep", "Write"],
      "task_schema": "schemas/task/aggregator-task.schema.json",
      "result_schema": "schemas/result/aggregator-result.schema.json",
      "enabled": true,
      "category": "validation",
      "supports_parallelism": false,
      "execution_mode": "workspace_write"
    },
    "coder-fix-validation": {
      "file": "workers/coder-fix-validation.md",
      "model": "opus",
      "max_turns": 50,
      "permission_mode": "bypassPermissions",
      "tools": ["Read", "Glob", "Grep", "Write", "Edit", "Bash"],
      "task_schema": "schemas/task/coder-fix-validation-task.schema.json",
      "result_schema": "schemas/result/coder-fix-validation-result.schema.json",
      "enabled": true,
      "category": "execution",
      "supports_parallelism": false,
      "execution_mode": "workspace_write"
    },
    "improvement-analyzer": {
      "file": "workers/improvement-analyzer.md",
      "model": "opus",
      "max_turns": 50,
      "permission_mode": "acceptEdits",
      "tools": ["Read", "Glob", "Grep", "Write", "Edit"],
      "task_schema": "schemas/task/improvement-analyzer-task.schema.json",
      "result_schema": "schemas/result/improvement-analyzer-result.schema.json",
      "enabled": true,
      "category": "improvement",
      "supports_parallelism": false,
      "execution_mode": "workspace_write"
    }
  }
}
